,title,score,id,url,comms_num,body,comments,timestamp
45,A Hong Kong fan of Blizzard showed his commitment after Blizzard banned Blitzchung for his recent interview supporting HK.,380,df3rpt,https://www.youtube.com/watch?v=IjwY_3Mizag,18,,"[All in. Respect, In Germany we say Ehrenmann, The Hero we all need., Damn, if you're going to destroy your own merchandise, please be more careful.  It seemed like he nearly drilled/cut his own hand.

That aside, this guy is incredible.  To invest so much time and money into a company's incredible creative works that were forged from free thought and expression that now openly welcomes the oppression of that same freedom for some blood money.  This man could've sold it if he thought all his Blizzard merch is an eyesore and made back tens of thousands of dollars but it's clearly not about the money.  Blizzard and the CCP is a disgrace to humanity and they both deserve to collapse. May Hong Kong and the rest of the world win this fight for a brighter future., Now he can collect hk merch. I know the feeling., I'm no fan of Blizzard but I'm almost crying watching this...I can totally imagine how much pain it is, It must feel so good to purge that shit.I've been hanging onto a few things ""just cuz"". Now, I finally have a good reason to get rid of it all and reclaim my space!, Damn man is he crying?

The strength he displays is respectable, Respect. But also, what a dork. I say that admiringly. hahahaha, Respect, This is amazing. Well done. 

Can I make one request though? If anyone has clothes they're going to destroy please don't cut them up, donate them to a homeless charity. It'll make some good come from this betrayal on humanity., Wow! This needs to be seen by way more people.. respect!, act of honor and activisme. god damn respect]",2019-10-09 04:08:17
46,Dear NBA and Blizzard,599,dfs7rx,https://i.redd.it/7m02tcq6vmr31.jpg,12,,"[Nike and Disney, The NBA has come out and said they won't be censoring anyone's free speech, and if that means they lose China then they lose China and they'll accept that. We really can't expect anything more than that. The NBA are not the bad guys, please delete this.

Before anyone brings up what happens in stadiums, that's decided by the stadium's team, not the NBA.]",2019-10-10 13:30:01
47,"Art in protest of the actions of Blizzard, NBA, and other companies caving in to the evils of the PRC",1303,dfby9i,https://i.redd.it/6yvp8sfi0gr31.png,9,,"[Sorry if this is a bit ignorant, but what did Disney do?, The NBA supported owners and players ability’s to choose and stand by there choice and ideology of the protests]",2019-10-09 14:28:10
48,"Hope this doesn't get forgotten in new, drew it in class today after reading about Blizzard and Hong Kong. Hoping for the best for the brave protesters, they deserve it to win this. Fuck China and Liberate Hong Kong!!",250,dgc93a,https://i.redd.it/ohg3mq6wjvr31.jpg,18,,"[Quick edit: I will try and colourize this soon, and also feel free to repost or anything!, Thank you!!!!, amazing!, I think it’s important that you change it from fuck China to fuck the CCP, China has over a billion people and not all of them support what’s happening, they just can’t say anything for their own safety. This is the fault of the CCP and that’s who we should be directing our hate to, not all of China

But also I love the art really great work, Edit: Fuck the CCP, Here’s a link for an event being organized to protest at Blizzcon. It’s fairly new so not much traffic but has raised $2,000 on gofundme in less than a day as well as been pinned to the top of R/ProtestBlizzcon


https://www.reddit.com/r/ProtestBlizzcon/comments/dg95gc/facebook_event_set_up_to_organize_the_blizzcon/?utm_source=share&utm_medium=ios_app, [effacé], I started drawing it on whiteboards in class

Though I'm always worried because I never know whether some of the Chinese people are mainlander and pro ccp or ex-mainlander and anti ccp]",2019-10-11 18:42:50
49,Please read if you've discovered our subreddit due to the NBA or Blizzard fiasco,489,dfjvrj,https://www.reddit.com/r/HongKong/comments/dfjvrj/please_read_if_youve_discovered_our_subreddit_due/,11,"Welcome! Thank you for your interest in supporting and learning more about the situation in Hong Kong.

Here's some questions you may have and some answers:

1. **What can I do to support the movement in Hong Kong?**  
Please check out the following thread: [https://www.reddit.com/r/HongKong/comments/cv0ws4/how\_can\_you\_help\_hong\_kong\_protests\_from\_abroad/](https://www.reddit.com/r/HongKong/comments/cv0ws4/how_can_you_help_hong_kong_protests_from_abroad/)  
We appreciate the Mei memes but we're seeing a lot of duplicate threads being created here. If it's just some random meme you've found on the internet and not something you created yourself, odds are that somebody has already posted it. Please upvote that post rather than create a new thread. News and other things are getting buried in noise.
2. **What are the protests about?**  
Hong Kong is NOT fighting for complete independence from China. The protesters have 5 demands:
   1. Full withdrawal of the extradition bill
   2. A commission of inquiry into alleged police brutality
   3. Retracting the classification of protesters as “rioters”
   4. Amnesty for arrested protesters
   5. Dual universal suffrage, meaning for both the Legislative Council and the Chief Executive
3. **Where can I learn more about the protests?**  
Here's a bit of background reading that I recommend: [https://www.vox.com/world/2019/8/22/20804294/hong-kong-protests-9-questions](https://www.vox.com/world/2019/8/22/20804294/hong-kong-protests-9-questions)  
Here's a more detailed timeline of events that have happened these few months: [https://tl.hkrev.info/en/timeline/](https://tl.hkrev.info/en/timeline/)  
Also check out the megathread of this subreddit: [https://www.reddit.com/r/HongKong/comments/cxsz4i/megathread\_resources\_for\_antiextradition\_protest/](https://www.reddit.com/r/HongKong/comments/cxsz4i/megathread_resources_for_antiextradition_protest/)

If you've gotten this far, thank you! The people of Hong Kong have been fighting a long battle to protect our freedoms and we appreciate your interest in the situation. While protest related art is definitely welcome, I kindly ask that you be cognizant of the amount of meme reposts that are currently flooding the subreddit.

**To all people who have been in this community for a while**

I understand that the amount of meme reposts can drown out some of the more important news. New members of our community may not be as familiar with the subreddit rules and simply excited to share something. Please be patient with them. I would rather have newcomers feel welcome here even if I've already seen what they have to say dozens of times. I've been delayed for many hours on public transit in Hong Kong due to public transit shutting down these past few months. A few extra seconds of scrolling is insignificant compared to that and I will not complain when the future of this city is at stake. Feel free to save the links above and share with anyone asking the above questions. Even if it's the 50th time you're answering the question, it's the first time the newcomer is asking it so please be patient.","[It's been amazing to watch this all unfold, that one man's tweet and one gamer's support for his own city have turned two massive industries into turmoil and raised the topic of Hong Kong yet higher in the world's perception. 

It's so so good to see, but as the op said please keep the signal to noise ratio high on this sub. There's some real shit still happening in Hong Kong so let's keep the focus on those events in this sub. If you want to follow day to day events the live twitter feed is a a great resource. You can watch livestreams direct from the front lines at http://freehk.live (at the right times - they sleep too) and ""chilli lucas"" on YouTube does English translations.

I hope those of you that will have a lot more free time now that you're done with Blizzard will stay with us and follow what's going on. 

Be aware that this sub is the constant target of wumao (CCP paid commenters) so make sure to check people's comment history. They can be subtle and their preferred tactic is to sow doubt and confuse topics, not always face head on.

Also, while you're at it check out the BBC's investigative videos on Xinjiang's concentration camps that are on YouTube, that needs awareness maybe even more than Hong Kong does. Hong Kong has done a great job of international PR, Xinjiang hasn't been so noticed.


Hong Kong is just one battle, the war is against the CCP., This should be pinned, You should change your protest demands to one demand: Independence  


You've got proof from how they are going to treat you, and continue to treat you, even if they relent on some of the demands. You're lost, unless you fully fight for independence.  


There is zero future for Hong Kong if China continues to claim you, you will either all die, be enslaved, sterilized, or educated into hating liberty., Thanks for this post, This should be pinned.]",2019-10-10 02:56:08
50,"I remade blizzards ""Core Values"" outside their HQ, to fit their current actions regarding HK",886,dfeyvx,https://i.redd.it/531dtbmophr31.png,9,,"[Wow, this is so hypocritical. 

Blizzard seemed like a chill company too., It'd be cool if someone hung a HK flags from that axe, I'd seen this statue before but never realised the sign was just a target the orc was getting ready to smash...]",2019-10-09 20:11:09
51,Epic games showing the pair Blizzard lost,125,dflgpv,https://i.redd.it/1uoobbs98jr31.png,22,,"[That's awesome. I don't play Fortnite, but I was wondering when this got bigger how they would react. Way to get ahead of it Epic!, Eh, Tim Sweeney's got a history of flip flopping on things so we'll have to wait and see., Wtf I love Fortnite now, Maybe.... Fortnite not bad?, I doubt their position on free speech will last long considering Tencent is a major shareholder., So freedom of speech also entails the freedom to support China as well, this is such a PR nightmare because as someone who has worked in Community Management for MMO's and as a Game Master, I am usually the meat shield for gaming companies.

Blizzard exactly in the wrong for banning Blitzchung, they acted out in a neutral manner and enforce their own rules. If Blitzchung made a comment saying 'All hail China and punish to all Hong Kongers', he would have been dealt with in exactly the same manner!

Unfortunately for Blizzard, the incident took place on a Livestream for a pretty big tournament and the winner just happened to behave in an unprofessional manner.

Regardless of my personal opinion (because I do support peaceful protesting and the basic human rights and democracy for Hong Kong) I'm not going to let my bias judgement cloud my opinion over what a neutral party should do and in that situation, you either let both sides argue it out, with the Mainland people vocalising their opinions and the Hong Kong supports to vocalise theirs and escalating the debate into a toxic cyber warfare on Blizzard's platform or you neutralise the situation and control the flames as much as possible without adding more fuel to the fire.

I'm not sure if this is a publicity stunt, but even Epic has a clause in their Terms of Service and Code of Conduct and Ingame rules that prohibits the promotion of propogana and the promotion of Religious, Political or Social views on others. Game Developers and CEO's and people who basically don't interact with the community at large or manage their playerbase really don't have much say on the matter as they basically have zero idea of what is going on. Basically Tim would just recieve a report going off what the Community manager says and usually some poor GM or Moderator has to deal with the mess and feedback to them.]",2019-10-10 04:47:53
52,Have fun Blizzard,180,dfqpfv,https://i.redd.it/9tnmhiqi7mr31.png,17,,"[Good luck getting an answer., To: dpo@blizzard.com

Subject: GDPR - Data Subject Access Request


Dear Data Protection Officer,

In accordance with GDPR Article 15, I am hereby requesting access to my personal data (associated with my email address).

Please confirm whether you are processing personal data (as defined by GDPR Article 14 (1) and (2)) concerning me.

Furthermore, I am hereby requesting that you deliver a copy of personal data, other supplementary information pursuant to GDPR Article 15, and the following information:

* all personal data concerning me that you have stored;

* the purposes of the processing;
* the categories of personal data concerned;
* the recipients or categories of recipient to whom the personal data have been or will be disclosed, in particular recipients in third countries or international organisations;
* where possible, the envisaged period for which the personal data will be stored, or, if not possible, the criteria used to determine that period;
* the existence of the right to request from the controller rectification or erasure of personal data or restriction of processing of personal data concerning the data subject or to object to such processing;
* the right to lodge a complaint with a supervisory authority;
where the personal data are not collected from the data subject, any available information as to their source;
* the existence of automated decision-making, including profiling, referred to in Article 22(1) and (4) and, at least in those cases, meaningful information about the logic involved, as well as the significance and the envisaged consequences of such processing for the data subject.

* Where my personal data are transferred to a third country or to an international organisation, the appropriate safeguards pursuant to Article 46 relating to the transfer.

* CCTV images of me and photographs, descriptions of clothes I wore, dates of visits etc.

In accordance with the regulations, please deliver your response within 1 month from today's date, October 10, 2019. i.e., because November 10 falls on a Sunday, your response is to be delivered to be by or before Monday November 11, 2019.

As per Article 20, the information is to be delivered in a structured, commonly used and machine-readable format.

https://gdpr-info.eu/art-15-gdpr/

https://gdpr-info.eu/art-20-gdpr/

Regards,, Good luck, thank you, and keep us updated!, This guy laws, Make this request across Europe. That should keep Blizzard busy and worried., It just seems kinda annoying. Not really gonna stop them in their tracks...]",2019-10-10 11:17:21
53,Boycott Blizzard. Free Hong Kong.,692,dg10op,https://i.redd.it/exj15dwewqr31.jpg,6,,"[Why is Blizzard getting all the heat? You should save some for Apple, NBA and others..., [effacé]]",2019-10-11 03:04:10
54,"As an American, I will be boycotting any company that trades freedom and human rights for money. That includes Blizzard, Disney, and all the rest. My thoughts are with you, Hong Kong.",119,dg666c,https://www.reddit.com/r/HongKong/comments/dg666c/as_an_american_i_will_be_boycotting_any_company/,15,,"[not sure there are any electronics not produced in china., So all companies, also league, i remember so many players being silenced for bringing up china, I think you just relegated yourself to the stone age., Also google and apple., Found out there are some electronics not manufactured in China. Japan, South Korea, and other places manufacture electronics. 

Seems parts of the iPhone are manufactured outside of China but China is where its assembled., I've been doing the same.  I'm definitely not buying more , or more subscriptions. I was going to pre-order wc3 remastered...not anymore., Don't forget about big oil, they walk all over human rights too]",2019-10-11 09:07:36
55,Reddit is now targeting Blizzard Entertainment,912,dfvn2j,https://i.redd.it/fgk6o3d6qor31.png,6,,"[What about Apple for removing the police locating app at the request of the Chinese government?, If the memes stay in this sub then no, all of Reddit does not know China is here.]",2019-10-10 19:46:13
56,Blizzard is so inspiring,2522,dfairp,https://i.imgur.com/UPrYFMA.jpg,4,,"[I'm so glad I never gave them my money, Lets get #MeiWithHongKong trending on twitter, So much for a triple bottom line (people, planet, profit)., Ouch]",2019-10-09 12:17:54
57,Blizzard: Do you guys not have democracy?,573,dffqx6,https://i.redd.it/un6v1q154ir31.jpg,6,,"[No, no we don’t :(, What was the context lol, it all makes sense now.]",2019-10-09 21:35:50
58,"I am leading a protest in Irvine, CA at the Blizzard Headquarters",139,df63mg,https://www.reddit.com/r/HongKong/comments/df63mg/i_am_leading_a_protest_in_irvine_ca_at_the/,11,"This is a peaceful protest. Please do not bring weapons or bad attitudes. 

&#x200B;

We will be standing outside the Blizzard Gates. Please bring signs and good vibes. 

&#x200B;

WE WILL BE HEARD, EVERY VOICE MATTERS!

&#x200B;

LIBERATE HONG KONG, DO NOT BOW TO THE CHINESE. 

&#x200B;

&#x200B;

Where: Blizzard Headquarters   1 Blizzard Way, Irvine, CA 92618 

When: 10/10/2019 @ 8AM PACIFIC TIME

&#x200B;

&#x200B;

Twitter:  [https://twitter.com/kixx111](https://twitter.com/kixx111)","[I will do what I can. Thank you everyone that is standing up for your rights. Thank you for being brave. I am an American and I stand with you., Best of luck., Post videos if you have a chance., Thank you, Thank you for the support! 8AM on a Thursday is ultra early for gamers but I hope you get a good turnout!, Not all heroes wear capes.]",2019-10-09 06:54:49
59,When I see people boycotting blizzard for Hong Kong,1103,dftxa8,https://i.redd.it/hixrfi36qnr31.jpg,4,,[Texas stands besides Hong Kong.],2019-10-10 16:23:39
60,"Instead of Blizzard, people should boycott TikTok",113,dg8jw5,https://www.reddit.com/r/HongKong/comments/dg8jw5/instead_of_blizzard_people_should_boycott_tiktok/,11,"For those not in the know, TikTok is wholly owned by ByteDance, a Chinese internet company whose main business in China is TouTiao.

TouTiao is China's biggest news aggregator app, complicit in distributing mass amounts of propaganda and misinformation to its 200 million daily active users each day. TouTiao, along with Tencent news, and Netease News, are all part of the mass state propaganda machine designed to distract the Chinese public from the truth. When they are not delivering propaganda, they are spewing out straight misinformation most of the time. A misinformed population is a population easy to manipulate.

But nobody in the west seems to give a shit about TikTok? Instead, people are circlejerking on Blizzard and NBA, two companies in a long list of corporations who have caved to Chinese demands in the past.

Caving to Chinese demands is the price of doing business in China. I've worked in the past couple of years as a marketing consultant in Mainland China, and you would be hard-pressed to find any foreign company in China who hasn't caved to Chinese demands ever.

The biggest enemies of authoritarianism are not missiles nor tanks, but cars and washing machines. Forcing these companies out of China will only further isolate the Chinese consumers, limiting their options and potentially their entry points to the world outside China. It's the same shit with the Google debacle a couple of years ago - Google wanted to launch a censored version of their search engine in China, but was shouted down by the internet. This WOULD HAVE BEEN A GOOD THING FOR THE CHINESE, for people would have another option outside of Baidu, a heavily skewed and censored search engine, and better for promoting the flow of ideas in China.

Seriously, boycott TikTok instead.","[I've already been boycotting TikTok because it's fucking stupid and annoying., Not instead. In addition., Boycott both, Don’t gotta tell me twice, fuck tiktoks trashy ass, Why not both?, the fuck is tockit tick?, Obvious answer is boycott tiktok, blizzard, Tiffany, apple and all companies that support regimes that oppress/rape/murder/torture., Before you dl any app, just look up where it's made.  If it's made in china just say no., They also steal your personal data, but some damn idiots made it the new vine. I’ve been boycotting from the start.]",2019-10-11 12:19:33
61,It's ACTIVISION Blizzard not just Blizzard,112,dfewjo,https://www.reddit.com/r/HongKong/comments/dfewjo/its_activision_blizzard_not_just_blizzard/,13,"I want to say that Blizzard is not just Overwatch, Diablo, World of Warcraft but also Activision.

This means there's also Call of Duty, Crash Bandicoot, etc. I'm not saying to boycott them. I'm just letting people know so they can CHOOSE to boycott them because THAT is the freedom Hong Kong people are fighting for.","[This. Activision should take just as much of a hit as blizzard, they're dickheads, too., destiny no longer a part of them if i remember correctly, Activision-Blizzard no longer publishes or has any stake in Destiny or Bungie anymore, Bungie bought themselves out of the contract early this year., NOT DESTINY, THEY SEPERATED FROM THEM ABOUT 3 MONTHS AGO, Activision has nothing to do with Destiny or Bungie anymore. You can play it guilt free, Also the new Call of Duty Mobile was made by Tencent along with Activision. The worst combination., Destiny is no longer associated with Activision Blizzard. You should edit the post.]",2019-10-09 20:04:11
62,PSA: For those wanting to sever ties with Blizzard Entertainment over the Blitzchung controversy-,96,dexu67,https://www.reddit.com/r/HongKong/comments/dexu67/psa_for_those_wanting_to_sever_ties_with_blizzard/,11,"If your Blizzard account is within the United States, [this link](https://us.battle.net/support/en/article/2659) will permanently delete your account, including all purchased games, content, and personal information.

For those who need context [this article from IGN](https://www.ign.com/articles/2019/10/08/hearthstone-pro-calls-for-hong-kong-liberation-during-live-blizzard-interview) is a good summary.

For those who can't reach the article; Blitzchung was stripped from the Hearthstone Grandmasters after publicly speaking out for Hong Kong. They also banned him for 12 months, denied his prize money, and terminated the contracts of the casters that let him speak out.

After supporting a company for over two decades, I will no longer support Blizzard Entertainment. I hope this guide, and miniscule action, helps those who stand with Hong Kong.","[Just submitted my cancellation request. Was looking forward to trying Overwatch on the Switch, but it's no big deal to spend my time/money elsewhere. Fuck woke capital., Support Gods Unchained.. they are giving the guy his prize money and more!

[https://twitter.com/hashtag/freegaming?src=hashtag\_click](https://twitter.com/hashtag/freegaming?src=hashtag_click), Anyone else being denied when trying to confirm identity by email code or security question? Sending Blizzard my ID is the last thing I want to do right now.  


I'm being told that there were too many failed attempts after the first time I entered the correct information (on two separate accounts!), so something seems iffy, Wait what happened?]",2019-10-08 19:59:36
63,Blizzard employees standing with hk,313,dfc6ir,http://Imgur.com/a/bvXCKYU,6,,"[This is what we want to see. Those on the inside need to make their voices heard! We can't discredit the entirety of Blizzard. The same goes for the NBA! We need to let the voices of those within the corruption to stand out! STAND WITH HONG KONG., I feel this was a decision made by the higher-ups to mitigate the backlash over the recent pro CCP support, They are some brave employees, hope Blizzard won't pull a Cathay on them.]",2019-10-09 14:51:39
64,"Blizzard banned a pro Hearthstone player from competing for a year and took away his prize money and fired 2 casters for simply letting him voice his opinion about Hong Kong in the Grandmaster Championship, they are deep in Chinas pockets, would be a shame if their biggest IP got banned in China.",287,df7kju,https://i.imgur.com/1Bx9hdH.jpg,7,,"[By biggest do you mean thiccest?, [effacé], Post it with #MeiWithHongKong on twitter]",2019-10-09 08:33:51
65,Blizzard announced Xi Jinping as a new Overwatch character with this teaser image.,328,df8d1n,https://i.redd.it/k4btr66njer31.jpg,6,,"[动态网自由门 天安門 天安门 法輪功 李洪志 Free Tibet 六四天安門事件 The Tiananmen Square protests of 1989 天安門大屠殺 The Tiananmen Square Massacre 反右派鬥爭 The Anti-Rightist Struggle 大躍進政策 The Great Leap Forward 文化大革命 The Great Proletarian Cultural Revolution 人權 Human Rights 民運 Democratization 自由 Freedom 獨立 Independence 多黨制 Multi-party system 台灣 臺灣 Taiwan Formosa 中華民國 Republic of China 西藏 土伯特 唐古特 Tibet 達賴喇嘛 Dalai Lama 法輪功 Falun Dafa 新疆維吾爾自治區 The Xinjiang Uyghur Autonomous Region 諾貝爾和平獎 Nobel Peace Prize 劉暁波 Liu Xiaobo 民主 言論 思想 反共 反革命 抗議 運動 騷亂 暴亂 騷擾 擾亂 抗暴 平反 維權 示威游行 李洪志 法輪大法 大法弟子 強制斷種 強制堕胎 民族淨化 人體實驗 肅清 胡耀邦 趙紫陽 魏京生 王丹 還政於民 和平演變 激流中國 北京之春 大紀元時報 九評論共産黨 獨裁 專制 壓制 統一 監視 鎮壓 迫害 侵略 掠奪 破壞 拷問 屠殺 活摘器官 誘拐 買賣人口 遊進 走私 毒品 賣淫 春畫 賭博 六合彩 天安門 天安门 法輪功 李洪志 Winnie the Pooh 劉曉波动态网自由门, I almost, maybe. Will. Actually probably. Definatly. Think about saving you some honey., Just get #MeiWithHongKong trending on twitter., Damn, he’s much more OP than these characters.]",2019-10-09 09:31:03
