,title,score,id,url,comms_num,body,comments,timestamp
16,Blizzard is banning people in its Twitch chat for pro-Hong Kong statements,2209,djvg1t,https://www.theverge.com/2019/10/18/20921301/blizzard-bans-hearthstone-twitch-chat-pro-hong-kong,59,,"[Completely ridiculous tbh — they’re obviously not a neutral party in this (as they’ve already proven themselves to be in Beijing’s pocket) — so for them to act like they have some sort of moral neutral high ground now is complete bullshit., Then they would have no viewers, dumb ass blizzard shouldnt have doubled down, You'd think they've learnt their lesson by now., Fuck blizzard, This is the best tl;dr I could make, [original](https://www.theverge.com/2019/10/18/20921301/blizzard-bans-hearthstone-twitch-chat-pro-hong-kong) reduced by 76%. (I'm a bot)
*****
> As the summer went on, Hong Kong police escalated their use of force, deploying tear gas, bean bag rounds, and in some cases, live fire.

> On October 8th, the company issued a yearlong ban to Ng &quot;Blitzchung&quot; Wai Chung, a prominent professional Hearthstone player from Hong Kong, after he said a pro-Hong Kong slogan in a post-game interview.

> After a public outcry, Blizzard reduced the length of the ban by six months and reinstated his prize money - although a week later, the company suspended three college Hearthstone players for six months after they held up a sign that said &quot;Free Hong Kong, Boycott Blizz&quot; during an official competition stream.


*****
[**Extended Summary**](http://np.reddit.com/r/autotldr/comments/djyoia/blizzard_is_banning_people_in_its_twitch_chat_for/) | [FAQ](http://np.reddit.com/r/autotldr/comments/31b9fm/faq_autotldr_bot/ ""Version 2.02, ~436022 tl;drs so far."") | [Feedback](http://np.reddit.com/message/compose?to=%23autotldr ""PM's and comments are monitored, constructive feedback is welcome."") | *Top* *keywords*: **Kong**^#1 **Blizzard**^#2 **game**^#3 **Hong**^#4 **player**^#5, This is getting carried away. FUCK BLIZZARD. Freedom of Speech you fucks. Boycott, its extensively discussed here:  [https://www.np.reddit.com/r/hearthstone/comments/djn4s9/playhearthstone\_is\_now\_censoring\_free\_hong\_kong/](https://www.reddit.com/r/hearthstone/comments/djn4s9/playhearthstone_is_now_censoring_free_hong_kong/) 

they are banning both pro-hk and pro-china messages., Good, they can't use the excuse ""pro players must uphold the tournament rules"" anymore, there is no way to spin this. An argument *could* be made it is to stop spam/troll, but it's not the best argument. Have rules like ""no more than 1 comment in the chat per minute or something to stop spam, Blizzard needs to die a slow corporate economic death.  Blizzcon is going to be at Anaheim Convention Center Oct 31-Nov 2 for loads of fun in da streets. https://blizzcon.com/en-us/event-info Gamers for Freedom event on Nov 1 noon to 3 p.m. https://www.facebook.com/events/402379580661468/ looks like it could get big, Looks like a repost. I've seen this link 7 times. First seen at [Techfeed](https://redd.it/djtes3) on 18-10-2019

**Searched Links:** 23,431,202 | **Indexed Posts:** 207,319,842 | **Search Time:** 0.0111s 

*If this is useful, comment '**Good Bot**'. Feedback? Hate? Send me a PMor visit r/RepostSleuthBot*, The truth is, if you go in and spam ""long live China"" a thousand times, you'd get banned too... They are just banning people for any spam. And for message unrelated to the games..., if they prefer the china market to west, they should move to china., I mean even riot games isn't banning people from saying free hk in their twitch chat, Their platform, their rules.

If you don’t like it, stop playing., ESL is already doing that, can't even type 'hong kong' in their csgo channel, This is self promotion sort of, but I support free speech whole heartedly. Why is no one else streaming a free Hong Kong message on twitch under the game Hearthstone? Will someone please help me to get the message out.

I'm fine with being banned from twitch.

Edit: and Reddit.]",2019-10-19 09:07:51
17,Regarding Blizzard and the HK situation,3724,df1rf3,https://i.redd.it/gy8av6b58cr31.png,82,,"[Solid. Bout to uninstall Overwatch when I get home., My comment was a little bit longer than yours but I too cancelled my subscription this morning.

I live near Irvine, CA and I would love to organize a protest at Blizzard's Headquarters there. If anybody is interested, send me a PM., Respect., I would have taken a screenshot of mine, but didn't think to, but my comment basically boils down to calling them spineless hypocritical shitbags, I support freedom of speech, therefore I am uncomfortable supporting a company that oppresses this basic human right, and punishes players who do not comply with its political views. #standwithhk

Goodbye Blizz, Blizzard is Asshoe, I too cancelled my sub today. Waited all year for Classic but if Blizzard wants to side with totalitarians they can go fuck themselves, Huge respect I love playing overwatch but i am uninstalling., Liberate Hong Kong, the revolution of our times

&#x200B;

Fuck Blizzard., You got it  [https://twitter.com/Hazeluff/status/1181555439776829440](https://twitter.com/Hazeluff/status/1181555439776829440), you can do more than just ""HK"", good job!, Ill do the same when i get home i like it., I wish I had a subscription to cancel in this way. Power to you. I hope enough people do this that Blizzard see the damage., I wish I had a blizzard game to uninstall, Unsubbing after work today, Someone give me the scoop?, Allready done., So simple, yet effective, Everyone should screenshot your cancellation and uninstall screens and posting them. I just did too., TF2 is better Overwatch, Did the same for my Hearthstone subscription.

&#x200B;

Also, demanded a refund., Must have played my first Blizzard game when I was 5 or 6 and that was Warcraft 2. Loved all their games but didn't play WoW or Overwatch. 

Well screw them now won't play any at all uninstalled Bnet. Bunch of money ccp butt lickers., I wish I was still active on wow so I could do this, I wonder what would happen to Destiny 2 if it was still with Blizzard/Activision..., I used every single one of those 500 characters when I unsubbed. Wanted to make sure I got the point across to whatever bot they have summarizing unsub reasons on their end., I too, [https://imgur.com/a/n5WOgoi](https://imgur.com/a/n5WOgoi), I did the same thing with me and my wife's account, although my response might've been a bit more... *vivid*, 2 letters worth 1000, Can't wait till I uninstall classic wow when I get home. And I was waiting for 5 years to play it..., DDOS Blizzard., https://m.imgur.com/gallery/VKYDp2n remember, Mei Ling stands with hong kong, It's like Bungie knew this was coming and parted ways with them before getting involved. Good on them, Destiny 2 is a good game., I havent played anything since Diablo 3 when it launched really but i just put in a ticket to delete my whole account. all my purchases and keys because, what the actual fuck is this world right now..., What did Blizzard do?]",2019-10-09 01:44:29
18,"People over profits. I'll never touch a Blizzard product ever again. 15 years of playing their games, never again.",2226,df4kz3,https://imgur.com/ekQQFEI,80,,"[I won’t play another one either. I’ll make sure to pass the word along to other gamers too, Totally support this, but it may be worth while to post stuff like this in its relevant subreddit as well. It will help get more eyes on the topic and help more people take action., Remember that Activision is the same company (Activision-Blizzard ring a bell?) and undoubtedly complicit, if not the source of their policy., Anyone talk about Vans design competition ? 
They removed the design with the highest vote - which has a yellow umbrella on the top, I won't ever touch a blizzard game again. Fuck you, blizzard., i'm not really caught up with the hong kong protests. may i ask why does everyone hate blizzard now?, How ironic, they make heroes that stand for freedom, yet allow China to influence them, I came to this subreddit because of the protesting I've been hearing what going on whit blizzard did they do something or is it just hate, Honestly I never enjoyed any of their games other than Diablo 1 and 2, and potentially Warcraft 3., Also pro tip- loosing their player base does hurt them, but you know what hurts them even more... losing a sale to a competitors game, What did they do, What did blizzard do?, Honestly this was just crossing the line. WoW had become so stale, <3, Cancelled my own and Wife's wow subscription and making sure to tell the scumbags why in the survey. They aren't getting another dime off of us ever again, Only truly free people can exercise their freedom of choice., You gave me goosebumps..., Hell yea!!!, Get an unofficial mei poster and change it to support Hong Kong, I play wow with my 7yr old, im not giving that up because someone made a political statment on someone else's platform., [effacé]]",2019-10-09 05:07:47
19,Blizzard really feeling the pressure now. Cancelled their Nintendo Switch Overwatch NYC Launch event.,1920,di536e,https://twitter.com/NintendoNYC/status/1183940424467173378,62,,"[What’s that Blizzard? It’s cold you say?, All the mods at /r/NintendoSwitch are deleting comments and banning users talking about it., They're at [EGX](https://www.egx.net/egx/2019/show-floor) in London this weekend, it'll be interesting to see how they'll be received by the community., I may, one day watch NBA basketball again. Blizzard is a lifetime boycott for me., When little Blizzard set its sights  
On China's yuan store,  
They said: ""Forget the human rights,  
We care for money more!""

""Those gamers, they won't really care,  
They're lazy to their bones!  
They don't know what is good or fair!  
And don't they all have phones?""

""This surely will be ending well,  
With Winnie we should side!""  
But Reddit memed them all to *hell*  
And Blizzard fucking died, Good time to mention how [Tencent has their hands in Nintendo via their Chinese distribution/localization deal as well.](https://www.reuters.com/article/us-tencent-nintendo-china/tencent-nintendo-to-localize-switch-games-for-china-idUSKCN1US0J3), [Woohoo!](https://billadelphia.files.wordpress.com/2012/08/burns_excellent.jpg)

Keep at it everyone!, I would love for Nintendo to make Blizzard choose between switch and China considering Japan isn't that much of a friend of China, but Nintendo and Tencent are working to release Switch in China., They should just do the launch in their homeland, not in the United States.

These Chinese companies SMH, what is blizzard? didn’t they make d2? ..., Moderators at r/nintendoswitch attempt to suppress free speech and political opinions. 

Why is it a bad thing if people want to talk about politics regarding a video game caught in the middle of a political situation?, Every event of Blizzard with be attended by people coslaying as Winnie the Pooh it'll be a mess for them.]",2019-10-15 18:56:24
20,"Blizzard, shame on you.",5570,dfah9g,https://i.redd.it/hp4vdf3ncfr31.jpg,52,,"[Tell me r/Blizzard is just this, just get #MeiWithHongKong trending on twitter, I want to express my sincere gratitude to those artists who made these artworks to support HongKong. I've seen so many these days and really touched by them. Every simple voice of support matters! Thank you!, I love this, Got hit with a Reddit app notification for this post. Keep up the good work! Fight for freedom!, What did blizzard do?, Let's not forget the major players here, Tencent. Tencent's probably biggest global market is Riot Games/League of Legends.

With the League world's going on right now I feel like some support from the teams participating, players, and spectators could also make a powerful point. Perhaps we can get the League community on board and really make this a strong push as a group of gamers., A-mei-zing!

But in all seriousness: Freedom for Hong Kong! Democracy for her people!, Thing is, it's not that Blizzard support Hongkong police and politics but they can't stand for a political opinion as a company without being attacked by China. This was a decision taken to prevent any harm from being done to the company., Mei is so polite she will smile even after gtting shot in her eye auch.

And what happened to you blizzard you used to be one of the coolest  gaming companies out there, now you are almost bad as EA. You die as a hero or live long enough to see yourself becoming a villain., My favorite! Nice work., Do you know the source / original artist for this?, Since the last one was buried under a pile of Alt-Right dickheads, here's another friendly reminder that [Pepe](https://www.adl.org/education/references/hate-symbols/pepe-the-frog) is a [Man Covered In Shit.](https://www.youtube.com/watch?v=ESvILHEE6cU) 

I don't want to tell people what to do or anything, it's your revolution, but please be aware that many, many people in the West [associate the frog](https://www.splcenter.org/hatewatch/2016/09/28/pepe-joins-echoes-new-hate-symbols) with [racism and fascism](https://i.imgur.com/GYsQ2cm.png) \- Pepe's own creator [fought a court case over it](https://www.splcenter.org/hatewatch/2018/03/08/%E2%80%8Bpepe-frog-creator-brings-copyright-lawsuit) and killed him off - so for Public Relations purposes it might be a good idea to keep him away from anything released internationally. 

Yours in solidarity!, Erm, I don't want to be a jerk, but why is the artist using that f\*cking racist frog? Literally the only people in the West who like him are arseholes. Might I suggest something less divisive? (Post upvoted anyway though)]",2019-10-09 12:14:12
21,"Hey guys, it's cool and all to be boycotting Activision Blizzard for banning a player for endorsing Hong Kong because of their affiliation with Tencent, but if you're going to do that, just don't forget to boycott ALL the studios Tencent owns.",926,df0mg3,https://i.redd.it/py99d7qatbr31.png,132,,"[Not gaming, but what about reddit?, But why paradox :0
Why do you do this to me..., time to delete my path of exile then, Cities Skyline is a really good game and I've already paid for it sooo...., Tencent only has a minor holding on Paradox Interactive, the major holder is WesterInvest AB so i suppose that doesnt counts?, IMO not yet, except you Blizzard, screw off.

Imma see if these studios are gonna suck up to China's influence, the moment they do imma start ticking the boxes on this list., I see they like to invest in studios that make repetitive copy pasta games., Son of a bitch I just finished borderlands 3 bro. Rip., POE monkaS, That was easy, I’m sorry Supercell:(, POE and LOL holy, how about wargaming?, Paradox? Didn’t hoi4 get banned in China for something?, Its not hard to stop playing all those games to stand with Hong Kong tho, What irks me about Blizzard is that its only 5%....they put 5% of their ownership ahead of all this. Considering the boom they've been having they could have easily let that go, deal with the legal bs and grab new investors. 

To me at least this shows it isn't about the Tencent ownership stakes but strictly about what future profits they're looking for from China as a whole. But I guess that money is more important than the bodies being thrown into the bay..., I don't care overly much about where corporations get their money; as long as they haven't made shit decisions because of it.

Thus Blizzard is dead to me.  But the others not necessarily so., If it's not over 50% they don't own it. I am not boycotting over a 5% share holding. Blizzard is toast cause of their actions. LoL, Grinding gear, Super cell and MAYBE Epic are worth boycotts. Paradox and Ubi aren't worth it., This should be easy enough, I'll wait for these studios to show their colors. Can't imagine Supercell is going to be saying much, but Epic I have high hopes for., Aw man I bought a glu mobile stock a few years ago and I was just hoping it would grow one day. Guess I gotta sell it now., It'd be a shame if people start seeding pirated copies of all their games., noted thanks for the heads up :), And nothing of value was lost, no loss on my side, Luckily all of the major developers here have consistently released nothing but overly monetised trash for the last... Oh I don't know, five years at least?, Supercell too?, Will leaving bad reviews also have an influence on rankings and therefore profits?, Paradox too? Haiz., Riot Games? :(, I only play HOI4 to re-establish Taiwan to the true China status., 5% ownership isn't the reason we are upset with Blizzard., Idk about you but I ant giving up assassin's creed for 5 percent, Grinding Gear Games, the only major developer in New Zealand ,bought and paid for by fucking Tencent. Today feels bad to be a Kiwi, Wow that was easy. Those studios haven't made a good game in... ever? At least 10 years., Where did you get these numbers? Not critiquing, just curious about how to find info like this., >Epic

How am I not shocked, 5% seems lie a low bar for Boycott purely on investment.  Activision blizzard is a shitshow of a company, but I'm unaware of anything anti HK by Ubisfot

[https://www.pcgamer.com/every-game-company-that-tencent-has-invested-in/](https://www.pcgamer.com/every-game-company-that-tencent-has-invested-in/)

&#x200B;

Don't forget things like Discord, and square enix if the bar is that low.

Edit Also looks like they may need us more than we need them

&#x200B;

[https://www.forbes.com/sites/ywang/2018/09/06/chinese-gaming-companies-target-overseas-players-as-regulators-clamp-down/#55e5087177b8](https://www.forbes.com/sites/ywang/2018/09/06/chinese-gaming-companies-target-overseas-players-as-regulators-clamp-down/#55e5087177b8), Thank you. Will stop buying games from these studios, And feel free to join us on r/fucktencent . Fight against tyranny every where you see it. And so we do., Playing monster hunter only so I'm in the clear. Yay, Boycotting them does nothing, those studios don't support China ( just yet) , i don't know why you're asking people to boycott these studios when they're just people making games.

I'll give exceptions to Ubisoft, Epic games and Riot Games though, they are sure to do the same shit like blizzard since they have tournaments that goes around the world and they will probably ban any Hongkong team from saying anything.

&#x200B;

Blizzard did that for china with only 5% stake in their company, imagine Riot Games, Valve good riot bad., Just another reason not to dl the epic store., I’m gonna delete path of exile! The server sucks, Riot games ffs, love league., can we get the other stuff as well....like discord and reddit stakes etc, Super easy, all of those studios other than paradox put out out mediocre to trash tier games., Dude, leave Grinding Gear Games alone., Im not boycotting Paradox because Tencent does not own the company yet]",2019-10-09 00:21:15
22,Blizzard did a no-no,4908,dfmnlb,https://i.redd.it/0fyccyr5pkr31.jpg,47,,"[No, club penguin doesn't ban you for saying this. (That I know of) it's a meme on Blizzard sucking China's large pulsing [Redacted], I think it would be a good thing if we started tagging parodies so that people don't flip out before realising something is made up and a joke.

Source: I don't play Blizzard games and penguin club is a long way back in my memory banks., Is this real? O_o, No? Did they really?, on overwatch i put "" free honk kong fuck the chinese governmetn"" in the general chat and that acc was permanently banned., You should try saying support China, they will also ban you for it. It goes both ways, neither side is right and Blizzard isn't going to be a bias bystander propogating a situation and helping it get out of hand.

They should remain neutral, allowing support for Hong Kong comments to go through, means also allowing freedom of expression for Mainland China people]",2019-10-10 06:12:40
23,Just so you protesters in hong kong know y’all just gained so many supporters from the west over the despicable cowardly move blizzard just did by banning a high tier pro hearthstone player and the two casters from that match for slightly saying that hong kong needs to be free!,2311,df0cpf,https://i.redd.it/iwu6u2pupbr31.jpg,56,,"[I’ve always hated Blizzard. Hate them even more now., It seems an odd reason for many to get involved, but I do hope this spreads the message further and garners more support., Your artwork has both inspired, and left me with a raging erection, Upvoted for exceptional drawing, However a videogame platform being assholes should not be the only reason we show support. Stand in solidarity for freedom., It could have remained as an opinion of a single person no one would have known.

By forcing Blizzard to do this, they just made the biggest advertising possible.

I mean how dumb can they be? Now all planet knows about this LOL, -->CCP semen
FTFY, I feel **physically sick** looking at this.  

If you have been to the toilet at Chinese gas station, which the urine bowl was blocked and people still pee on it to make a liter of urine, then you know what I'm talking about, this is ten times worse than that., Fucking Cowards, And I Had Just Pre Ordered COD: MW 2019 Too, Man, he be chugging..., Hey, don't drink too much of it, they needed 5 days to produce that much, Question as I'm behind on the news, what did Activision do? Trying to figure out who I'm boycotting :), This is giving me a reason to stop playing Hearthstone and boycotting Blizzard., Although Blizzard should not have done this, I am thankful that it raised awareness in the west., But It’s So Good ;~;, I feel like we are at a crucial point in the support for Hong Kong. The American people are with Hong Kong., Blizzard used to be a decent company. When Activision bought them I lost a bit of respect. I have no respect now., Westerner here, now that I no longer give money to Blizzard I can give it to the democracy movement in HK instead. How can I help?, Fuck China 🇨🇳, Pretty sad that these gamers are only paying attention when it affects a few esports people, but glad they’re paying attention to what’s going on in the world, now.]",2019-10-09 00:00:30
