,title,score,id,url,comms_num,body,comments,timestamp
5,"Honestly, forget the NBA. Forget Blizzard. Forget Apple. BOYCOTT TIKTOK.",7661,dgdwgn,https://www.reddit.com/r/HongKong/comments/dgdwgn/honestly_forget_the_nba_forget_blizzard_forget/,268,"I'm not saying that the NBA, Apple, and Blizzard don't deserve everything that has been said about them. They 100% do. And I'm not saying you should actually ""forget"" them.

*but*

I propose that we take all this energy we're using to shame them and aim it towards **TikTok.**

And if you use it, uninstall it.

TikTok is owned by a massive Chinese conglomerate called ""ByteDance,"" and **they censor content *not just in China,* but in the US and Europe as well,** based on Chinese censorship guidelines:

https://www.theguardian.com/technology/2019/sep/25/revealed-how-tiktok-censors-videos-that-do-not-please-beijing

>The documents, revealed by the Guardian for the first time, lay out how ByteDance, the Beijing-headquartered technology company that owns TikTok, is advancing Chinese foreign policy aims abroad through the app.

And **they are staunch supporters of the CCP and operate with the goal of advancing the CCP agenda** (if not just directly run by the CCP):

>CEO Zhang Yiming issued a letter in 2018 stating that his company would ""further deepen cooperation"" with Communist Party of China authorities to promote their policies.

https://en.wikipedia.org/wiki/TikTok#National_security_concerns_in_the_US

And, **they are actively censoring the Hong Kong protest, globally.** It's the only social media site in the west where searching for #HongKong returns *no results.*

https://www.washingtonpost.com/technology/2019/09/15/tiktoks-beijing-roots-fuel-censorship-suspicion-it-builds-huge-us-audience/

Reddit is here destroying US companies for making concessions to China, which is totally fair. But, at the same time, we're all posting TikToks all over reddit, and it's a top 5 app on both Google Play and the App Store. There's a TikTok subreddit (/r/TikTokCringe/) with almost 200,000 subscribers.

I worry that we have forgotten who we're really trying to punish, here. Did Apple and Blizzard and the NBA fuck up? Yes. Do they deserve the heat? Yes. But damaging US companies to punish the CCP is a small hit. At worst, it actually *helps* the chinese economy if we boycott US companies.

Going after TikTok, who is deeply-entangled with the Chinese government (and lets be honest, probably just *is* the Chinese government) and is directly implementing China-style censorship around the globe is a much better move, IMO.

#BOYCOTT TIKTOK

EDIT: A lot of people are mentioning how they already don't use TikTok. I've never used it either. I suppose a better message than ""Boycott TikTok"" would be ""spread awareness of TikTok's global censorship and CCP agenda.""

**You can all feel free to copy/paste my above post in response to comments about TikTok across reddit.** I don't mind.","[Sigh, ok.  Account deleted.  App uninstalled.  I'll switch the addiction over to duolingo., Aaah, thanks for letting me know, I'm deleting my account and the app ASAP., Oh, and if this wasn't enough reason to boycott... Tiktok, you may recall, was formerly called ""Musical.ly."" Musical.ly was sued by the FTC for $5.7 Million (the biggest civil penalty for a child protection case in the FTC's history).

Musical.ly was purposefully targeting children and collecting their data, knowing full well that it was illegal. The result? A whole lot of sexual abuse.

>That's a problem, the government says, because several of the app's default features implicate children's privacy. Unless the relevant settings are changed, profiles are public and all users can direct messages at any other user.

>""Indeed, there have been many public reports of adults trying to contact kids via the Musical.ly App,"" states the complaint. ""Until October 2016, the App had a feature where a user could tap on the 'my city' tab, which provided the user with a list of other users within a 50-mile radius, and with whom the user could connect and interact with by following the user or sending direct messages.""

>The government claims Musical.ly knew its app was popular with children under 13. 

>""Through the Musical.ly App, Defendants collected personal information as defined in the COPPA Rule, including first and last name; online contact information; the content of direct messages between users; photos and videos containing a child’s image and voice, and, for some period of time, geolocation information,""

https://www.hollywoodreporter.com/thr-esq/musically-reaches-landmark-settlement-ftc-alleged-violations-childrens-online-privacy-laws-1191147

Basically, fuck TikTok., By the way. Phones with the whole background permission checking thing sometimes pick up tiktok using the microphone permission in the background while it's not open., I’m 32 years old and I don’t even know what TikTok is., This post is so valuable. Thank you, The moment you feel unconnected from the new generation and you have to google wtf is tiktok., Tiktok censors LGBT content. What’s next?, Done. Deleted., indeed tiktok is HUGE in China., *5 year old child dances with winnie the poo* *5 Year old child gets banned on tiktoc, and the ccp keeps their eyes on her from now on*, Personally I thought most TikTok posts looked fake and staged anyway., Most of the meme community will uninstall it purely because of cringe, but this works to, fuck China, Even the less politically inclined people should get behind boycotting TikTok, if for nothing but the general cringiness of its contents., Considering it's popularity among western audience and even military personnels, as well as the fact that every entity in China is owned by the ccp de facto... How in the hell is this app not considered spyware?, And tiktok sucks in general, so win win!, They also record your face and save it for data collection, adding it to the massive central China database., Absolutely do NOT forget about the others. #boycottallofem, I just gave it a one star review. Hopefully more people do the same., League of Legends is owned by Tencent., Just sold my Activision/Blizzard stock and reinvested it into a Vanguard $VOO fund, I cannot support a company that supports the dictatorship of China., Supporting this boycott not because of political reasons, but just the fact that this platform is extremely toxic, Been doing that from day 1 when I found out what it was and realized nothing good would come of it. This really doesn't come as a surprise., I reported it for other objection and wrote stand with Hong Kong!, They are also allowing a massive surge of propaganda bots into their system.  Just scroll their home feed for awhile and you will get all of this US right wing/left wing propaganda accounts., I just downloaded the app to be able to give it a review.

It didn’t even finish downloading before I wrote the 1 star review., I am on the app, I have been aware of its chinese influence.  Not going to delete my account though, instead I will keep posting pro Hon Kong and anti CCP videos.  Right now if you search up ""HongKong"" in the app the first video tat shows up is mine, and the thumbnail is Xinnie the Pooh, its a video of me explaining very simply chinese censorship of Winnie the pooh, and then show an image Of Xi and Winnie side by side.  I see disruption from within the app as a possible route for protest.  I started the #Istandwithhongkong on the app, and people have already started using it., I've never used tiktok, and didn't realize they existed outside of china.  kind of like QQ or WeChat, Im loving how much light is being shed on the shady practices of so many companies. HK might go down in history as the beginning of something much bigger than just China. We're starting to see the true intentions of large companies!, I downvote every post I see on reddit that uses TikTok, then I comment telling them I downvoted only because of that.

I’m hoping if enough people do that then nobody will use it as they don’t get a positive reaction from it., Already forgotten. There are pirate streams of NBA games, I've switched to androids with no plan to go back to apple, deleted my blizzard account, and I don't even know what tiktok is., TikTok is censoring LGBTQ+ content too, This is so important. How can we get kids to understand and not support their own manipulation? Spreading awareness for adults is firstly important. If we don't support it, kids might catch on. I don't know much about Tik Tok but I recently became more aware of it from a comedian couples podcast ""your moms house"". I believe they're targeting it for relevancy to stay on the edge. I'm going to do what I can to contact and inform. We gotta stop this shit from spreading. Thanks OP., Boycotting a Vine clone app is like boycotting Instagram to hurt the US, not very effective. Tiktok is used by high schoolers and young adults to do Fortnite dancing over rap songs, it's not like Facebook where you log a ton of personal info that can be used against you.

And actual HKers arent using any of these govt approved apps, TikTok is cringy as hell ., What about Google?, Won't work, Tiktok's main demographic is kids that don't care., Aight mad easy.

Not like anybody would miss it. XD, or, boycott them all?, Glad that I have never used it in the first place., This is why I never got the app in the first place, Or install it. Give a bad review with something HK related and delete it again., You can boycott more than one company at once, you know., wtf is tiktok, Should I install, give it a bad rating, and then uninstall? Or just leave it alone?, WAY ahead of you on all of those lol., I already don't use TikTok. So... I guess I'm supporting the cause?, Repost the post (or use a bot) into the comments so that us mobile users can copy the text, Boycott PUBG and League of Legends as well., Why not boycott them all?, They’re also incredibly homophobic, Can someone cross post this to r/tiktokcringe and r/tiktokhumor, Oh hell yeah, further reason to hate Tik Tok, Not just TikTok but Wechat as well. It is owned by Tencent., CCP shills are also [using TikTok to dox protestors](https://np.reddit.com/r/HongKong/comments/d5gzdb/china_is_doxing_nationals_who_are_choosing_to/)., I installed just to leave this review.|
Fuck you and your company. You don't get to decide what content is acceptable for the rest of the world. You don't get to censor free speech for citizens of other countries. Fuck the Chinese communist party, and fuck your president Winnie the Pooh, I've been boycotting tik tok ever since those stupid adds on YouTube., Neckbeards and the like do not use tik tok anyways., I don't have the app, so I'll install it, uninstall it, and give it a 1-star review, Tik Tok wasn't good to begin with. Apple is over priced and I have never and will never buy any of their products. I have no interest in the NBA and the only thing I ever bought from Blizzard was Overwatch and I don't even play that any more., wait, people are on tiktok?, Brb im gonna go get banned from tiktok, Thank you. I just assumed everyone knew Tiktok was Chinese garbage. I will start telling people explicitly., Can someone inform me what Apple did?, I never had TikTok because of its ties with a Chinese company.  It made me distance myself from it further when I heard about censorship within the app., Hated tiktok anyway, so we good ;), They have also banned all LGBTQ+ content from their platform. All of it. Guys kissing, girls proposing to someone who’s not a straight guy, all of if., Don't forget. Boycott them all., I have never heard of TikTok, guess i can just keep ignoring its existence, Reddit is my one stop shop for who to be outraged at, thanks guys, Middle aged man here. I’ve been boycotting them from the beginning. What is it you say they do again?, Meanwhile the New York Times: [48 Hours in the Strange and Beautiful World of TikTok](https://www.nytimes.com/interactive/2019/10/10/arts/TIK-TOK.html?action=click&module=Editors%20Picks&pgtype=Homepage), fuck TikTok, #HongKong comes up what are you talking about? #HongKong also has 143 million views., Way ahead of you - I never corrupted my phone in the first place, You mean cringe and stupid Youtube ads aren't a reason enough to not use TikTok?, What’s really shocking for me is that TikTok has a 4.7/5 review score.

Based on 175K ratings. On App Store

https://apps.apple.com/us/app/tiktok-make-your-day/id835599320, I deleted that horrid piece of garbage because a guy picking his nose gets 10M views but actual good original interesting content gets buried.  Yeah im bitter, heh.  But I want to encourage everyone to delete that garbage anyways., I’ve been boycotting that terrible app since it was released. But I really wish I could boycott seeing the annoying ads too., Fuck yeah. Show them that they need to follow western rules if they want the trust from people in the west., Just say goodbye to all the Chinese tech companies/products and you are good...for the time being at least :), Thanks. Don’t have the app. But I have it a 1 star review anyway cos fuck them., What’s a tiktok, tiktok is such garbage and its more than just about being yet another tool of the CCP, Why boycott any platform at all when you can leverage it to distribute your message?
At their expense.

What we need is TikTok rock stars [wearing these t-shirts](https://www.reddit.com/r/HongKong/comments/dg9o72/free_hong_kong_shirts_for_san_francisco_nba/) while they do their thing., The fuck is tiktok?, Reinstalled just to delete account. Uninstalled again., I think the biggest impact we could have on the Chinese popular opinion would honestly be getting all major game companies banned in China. They have their own stuff but if wow, LoL, overwatch, HS, Steam and every mobile game as well, that would make a whole bunch of people mad. Pipedream, since capitalism doesn't care about democracy, but I could wish, I rather use Tiktok to express my support in the protest, Gave it one star on Google Play., That’s pretty wacky, Will it delete videos of people holding up a HK flag?, I have an account but I've been using it to spread awareness in the comments. There are lots o content creators there with big platforms who might not be as aware of this issue as Reddit is. If we could get the users who aren't gonna delete the app to spam HK support, then that could be a good thing., As a person without a tiktok, what can I do to boycott it harder?, I already don't use TikTok, partly cause censored platforms just aren't safe., Lol I’ve been posting photos of Xi as Winnie the Pooh and Tank Man and they keep removing them, That edit is key. Thanks for this., Uninstall wechat, tiktok, any app or software that's CCP backed., Thank you my friend -- I was considering getting TikTok, but not anymore., Can’t boycott if you’ve never had the app!!!, ...]",2019-10-11 21:38:59
6,"Blizzard is banning people on their forums for 1000 years for discussing hong kong and call it ""Trolling""",7950,dfx3sg,https://imgur.com/NbMONBz,251,,"[Didn't Hitler have ideas about a 1000yr dictatorship as well?, that mean Blizzard get 1000 years of shame!!!!!!

WE DON'T FORGET!!!!!

EXPECT US!!!!, Can they dig themselves any deeper? I swear they're about to pop out above ground on the other side of the planet they've dug so much., But see you at blizzcon 3020!, It's almost like junius ho runs blizzard. 

Boycott all their stuff, file complaints against them with governing bodies, raise awareness of their bullshit online, do whatever you can. Take them down. Note down the names of people in charge, and when they get jobs elsewhere, boycott that company too. (Note that some employees staged a walkout and they are good)., Hey, atleast it's not a perma-ban., What’s going on with blizzard? I’ve been out of the loop on everything about the HK protests since they began and have been trying to find out., Banned for 1000 years hits different than banned permanently, 1000 years? I don't see the company surviving the next few years.  
They have chosen the wrong hill to die on., Fuck Blizzard. Fuck China., They're no longer American. They can go chortle the balls of that Winnie the Pooh looking fascist bitch., Damn what am I going to do for the 905 years after I am dead...  will Blizzard be around?... really , will it?, Boycott everything Blizzard., Banned for one thousand years. Banished from my fandom. And now, you dare support the PRC? You are not prepared., I had my post (talking about old activision patents and my disdain for blizzard's move) mysteriously removed twice (rather quickly, mind you) before going to r/activision and actually getting it posted there., Idea? If blizzard won’t let you delete your account just start blowing up forums with pro Hong Kong talk, I get that they are removing posts. Isn't it against their rules to bring up politics? They said they're strictly a gaming company, yes? I saw that somewhere and I don't recall anyone refuting it. Correct me if wrong, please. 

But to clasify it as *trolling*? Thats a real low move, Blizzard., Blizzard, what have you become? I didn't remember you behaving like this., Wait so if im extremely toxic but say ""Long live China!"" I wont get banned?, 1001 years later ""I lived bitch"", [effacé], what massage blizzard think they give: ""no no no pls no political statements""

what massege they actually give: ""HOW DARE YOU CRITICIZE OUR COSTOMERS?!? WE WANT JINPINGS LIL ASIAN DICK IN OUR MOUTHS AND FUCK TON OF MONEY.""

i think u got my point..., A 1000-year ban is clearly not enough. We all know Chinese emporers live 10000 years., Hasn't happened to me yet..., Well blizzard, it was a good run lmao, [ONE MILLION YEARS DUNGEON](http://m.quickmeme.com/img/19/19d8dfce8b1b2735878d45c3b2426eb95d77951b349471c03cd2931827c3777d.jpg), I know what I'm going to do when I get home., deleted  ^^^^^^^^^^^^^^^^0.2804  [^^^What ^^^is ^^^this?](https://pastebin.com/FcrFs94k/01171), Blizzard is a Chinese company now with the ego of a fragile 8 year-old., Why the hell do they even have a 1000 year ban instead of just permaban?, doesn't matter if you deleted your account anyways.

Get Bent Activision., #""Every voice matters"", Everyone should just get banned for a 1000 years. Blizzard be stupid af, Blizzard is the orcs unfortunately., Thank you for letting me know.  Blasted the forum boards and Im now waiting for my ban.  Im out, this is some corrupt bullshit., Well, this confirms that Blizzard is now run by the Chinese censors., My post was deleted., I love how much attention Hong Kong is getting with all of these ""controversies"", RemindeMe! 1000 years, The honey revolution., Yeah, disputing transaction for WoW subscription at this time. Fuck blizzard., If I wasn't done with Blizzard, now I am, This sums it up:

 [https://pbs.twimg.com/media/EGjj88gW4AAet8F?format=jpg&name=4096x4096](https://pbs.twimg.com/media/EGjj88gW4AAet8F?format=jpg&name=4096x4096), I really wanted to give Blizzard the benefit of the doubt, but I guess I was in the wrong. Which is a shame because they come out with decent games., sweet! I'll get on their n talk about chinas actions to delete my account then...since they want a picture of my license to cancel my account, i don't know what they think they're doing but this is how a company dies. not with a whimper or a shout but with a panicking PR department., Is this how the blizzard gonna end? shame for a company with such long history,   

I am not buying shit from them anymore., 1000 years? I only got [3 weeks](https://imgur.com/gallery/dzHInW4)., Does anyone have the email address of Blizzard executives? It'd be nice to start an email campaign of ""Fuck you and China, too"" to them.

If you are tricky about it, you incorporate ""Fuck you and China, too"" into a GIF or JPEG(stenography) so that it can't be screened for keywords and put into junk mail more easily., I'd like to see these ""discussions"" and judge for myself., isnt that illegal ?, only 1000 years, pfttttttt, What if the screenshotter tempered with the messaage (by inspecting HTML element)? Just saying., 1000 Year Ban!? Jesus Christ Blizzard. It Was Personal, But That Means War, LOL I wonder which will end first? Blizzard, the CCP, or the ban?, Well, just stop. That site is for gaming., lol, stupider than stupidity., >Reason for ban: “trolling” 
Okay..., [supprimé], I keep thinking... everyone on the internet has signed the “user agreement and terms”

Won’t China have access to all your email/phone/address/interest/friends & family?

Like if they wanna hunt you down, you’re gonna be found super easily., Is there a blizz forum for this discussion or are they all taken down already? I wanna test it and if they ban me for a thousand years then so be it., Everyone talking about the 1k year ban but noone is mentioning the reason? I mean trolling? If this is legit from today and op really talked about hong kong aren't they saying that the protest is just trolling? Or is this ban fake just to get on the band wagon?, Sounds like Blizzard games are a drug. Detoxt guys. Add oil.
Free Hing Kong., So there's a different way I can effectively delete my account. Nice, They just dig their hole deeper and deeper. It's gonna be fun to watch, Blizzard is totally retard......... How come a American company can work like this? Just because of money????, i hope we never waste our precious money on that pathetic company anymore, What a load of horse crap.

I wanna fly a plane over China and drop down flyers with Winnie the Pooh just to piss the fuckers off. Stay strong HK., Didn't realise they could sink lower and lower. Seriously, fuck you blizzard and fuck you xi, Talk about 9 degrees of execution, way to pay homage to your roots China, 1000 years? Why don't they just go with 100? 1000 is pretty much over kill., I'm shitposting HK love all over their forums, I want my millennium ban dammit., The Blizz forums have turned into TD. Censor all the negative hate, upvote all the blind people who think blizzard could never do any harm., 1000 years dungeon., Before this,I also got banned for 1000 years,but I got banned for ""trolling"" for making harmful jokes and having opinion, people call this 0.1 illidan ban in korea lol, Blizzard has always been like this, for example when they disqualified some guy from their tournament because he posted a pepe once. Free speech ftw, Time to change game tag to ""Chuck Fina"" and see what happens, GOOD?, Blizzard North: ""Every Voice matters""

Blizzard Today: ""Every RMB matters"", Wow, so THAT's the freaking line for them? For years the Blizzard forums have been the most vile, toxic shithole of asshattery. You'd have to be an unimaginably toxic scumbag to even get a 10 day ban, but THIS is what they hand out permanent bans for? 

I guess China is already here., Vampire: Hehehe, I can wait, Assuming that that isn't just a glitch, I would have to assume its a rogue moderator and that this will get corrected within a day., mad cuz bad.]",2019-10-10 22:12:11
