,title,score,id,url,comms_num,body,comments,timestamp
0,"Blizzard is protecting its company image and profit over human rights, Don't purchase their games anymore.",43407,dexk79,https://www.pcgamer.com/blitzchung-removed-from-hearthstone-grandmasters-for-liberate-hong-kong-comments/?utm_content=bufferc1413&utm_medium=social&utm_source=facebook&utm_campaign=buffer_pcgamerfb&fbclid=IwAR1qztKWRL7iXvpOJM369TLVEe8F9dQMR1y4Gv2BJNv1tfbGN4NwLK_RkXA,1228,,"[[Effective immediately](
https://twitter.com/Slasher/status/1181442535962632193), Blizzard has removed Hong Kong Hearthstone player blitzchung from Hearthstone Grand Masters, rescinded all his prize money, and have suspended him from pro play for one year for his recent interview., *uninstalls battle. Net*, I was going to resubscribe to play Classic, but if this is their stance, I’d rather buy a bloody EA game. Join me in boycotting Blizzard, if you are currently subscribed and intend to unsubscribe, make sure you write this as the reason on the questionnaire.

Edit: Obligatory thanks for the Silver! I’m happy to see so many people, not just here but in other Blizzard communities, take a stand on this issue and say this is unacceptable!, Boycott Overwatch that is about to come out on Nintendo Switch, Here is one situation where  a boycott may be in order. Let’s see if people are willing to give up those sweet sweet games though, Just a reminder that Tencent is a 5% stakeholder in Activision Blizzard. They also recently signed a massive NBA deal.

HMMMMM

EDIT: To respond to all the replies - I'm not saying this is the *reason* this happened. I'm just saying it's another aspect of the situation.,  Boycott **Blizzard!!!!!!**, I am now boycotting blizzard...going to uninstall [battle.net](https://battle.net) from my pc., Heard the news and instantly uninstalled Hearthstone, the fact that they did this is cowardly and disgusting., It was no really surprise given how they turned Diablo into a mobile pay2win., This is legit the best way of performing a stress test to see if China's business matters more than the rest of the world's., I haven't given them money since Activision got involved. Activision is, and always has been, a trashy company.

---

Never forget the Tienanmen Square Massacre (Chinese: 天安门大屠杀)!

光復香港 時代革命!

Free Tibet!

Protect the Uyghurs!

Release Inner Mongolia!

Support Taiwan!, I've left poor reviews for their games and mentioned this being the reason why.

Get on board, they are people first, a company second. Human rights before profit., Currently in the process of deleting my blizzard account. Don't just uninstall battle.net, delete everything you can., Man how shitty. Sure, at the end Blizzard is also just a company trying to maximize profits, but it's incredible how profits can easily make them throw basic human rights like just stating your own opinion over board., Here is a copy of the email I sent them this morning. Waiting for a response before I delete the account completely. 

&#x200B;

Good Morning, 

I was just curious as to what happened to blizzard? How much money would we need to raise to get you off of China's funds? Banning a esports player for supporting Hong Kong is by far the most disgusting action this company has done and you guys partnered with Activision!! As a company you make a weak claim that you are protecting your image by attempting to silence this person, however in doing so you have proven your real opinion. Blizzard cares more about profit then about the freedom the people there are fighting for. Shame on this company. I know it's not much for one person to stop playing anything related to blizzard but I'll be doing so and encouraging my friends to do the same. Perhaps you have missed the video's of emergency services in tears because they are being physically blocked from assisting protesters, or the video of children as young as 10 being arrested. How about the videos of peaceful protesters being shot in the face with bags and losing their eyes? How much is their eye worth blizzard?  Maybe you've missed the news where they've banned masks in an attempt to arrest more people. Maybe you've missed the recent news that protesters have been shot with real ammunition now versus the bags. I'm glad you are in America where you can openly run your business with no issues of the government ever limiting your freedoms. I hope your office is nice and cozy while these people fight for their freedom. You've made your opinion clear blizzard. Liberate Hong Kong, Revolution of our time., i'm ok to boycott blizzard, stopped playing their games since diablo2 lol, The funny thing is this:

The founders of Blizzard are Americans, the land of the free. They live in a country where democracy exists. They can sit in their offices, watch South Park, drink coffee, say whatever they like, do whatever they like, without fear of persecution.

And they do this to a Hong Kong player, because of money. 

Are they not rich enough? Are they so scared of their board members? Are they so scared of their investors?

I am not a Blizzard fan, and I certainly will never be a Blizzard fan.

PS: yes, I deliberately mentioned South Park.

Edit: persecution, not prosecution!, Blizzard has sucked for a very long time though, Don't worry, I've stopped buying anything Blizzard after they massacred my boy, Diablo, Why am I enthusiastic about boycotting spineless companies?
Yes.
Especially the gaming industry which is supposed to be one of the frontlines of uniting people from every corner of the world, their kowtow to a totalitarian regime makes me wanna puke., fuck this trash company, Boycotted, Already canceled and downloaded a private server for WoW Classic.  Blizzards never getting my money again., dOn'T yOu GuYs HaVe CiViL rIgHtS?

Fuck blizzard, fuck Disney, fuck NBA., Too bad, I liked Hearthstone. Never going to buy another pack., I took a look at my game library and I can proudly say...

""I didn't spend a dime on Blizzard, period."", I've been a supporter of Blizzard for over a decade. I have had a WoW subscription for probably 8 of those 10 years. Cancelled it today and will no longer support this company. At some point they have to make a stand for what is right., Well, I play Blizzard games. But haven't spent a dime on Blizzard for 2 years. Does that count as boycott?  Or does playing their games alone make them money?, Uninstalled. No time for this nonsense., I have no clue how a company could benefit from a free society with human rights and freedom of speech and then turn around and ban others for that very reason. It makes my blood boil how they value cash more than human rights., I have like a dozens of friends cancelling the preorder of the upcoming COD., Can't lose that sweet commie money, can they., Unsubbing from WoW, atleast for a time. I am quite busy with uni so haven't gotten to play much Classic but was subbed so i could log on when i felt like it, but fuck this., Activision, too, was gonna buy CODMW (beta was fun) but no, hell no, they sucked anyway. Never buying one again, way ahead of you, haven't bought anything of theirs for years, Is this even legal? Obviously Blizzard lawyers think so, so it probably is... but I thought this would fall foul of anti-discrimination laws.

EDIT: I see the TOS now that he supposedly violated, though that doesn't in itself make it legal. Like if someone revealed they were transgender and got the same treatment, I assume they would be in legal trouble.,  Sent in my [account deletion request](https://puu.sh/EqcXq/cc2e12efef.png) Fuck blizzard, Realize that most major gaming companies are owned by Chinese companies and 90% of the time it's Tencent, I hope those talking about abandoning Blizzard are also gonna abandon any other company producing in china that isn't condoning the action taking place in HK., Blizzard should ban themselves cause they just offended a portion of the public and damaged their own image., Destiny has left battle.net

There is literally no interesting games in their client right now, except for WoW, Everyone seems to be forgeting about activision, that means call of duty, Played wow for years, purchased damn Near every game they've made, spent a decent amount on hearthstone. Just deleted my account, go eat a big bag of dicks Blizzard!, Uninstalling when I get home tonight.  Blizzard & Activision can eat an entire bag of dicks.

They are not getting another dime out of me., Fuck Blizzard, This dude is really fucking brave for doing what he did. Really puts his own life on the line for others liberty!, It's not much.. but its about as much as I can do here in America.

[https://imgur.com/a/PQx9281](https://imgur.com/a/PQx9281), What the shit Blizzard, I thought you were cool., Fuck Blizzard., Wait, so he was a HK native? They seriously banned a guy for standing with his country? What the fuck?, Canadian here, been playing blizzard games since I was a kid. I’m cancelling my WoW sub and trying to get a refund on my Blizzcon ticket and WC3 Preorder. Blizz sold out to the devil., Fuck blizzard, Jokes on blizzard, now that destiny's gone I uninstalled the launcher, I don't like blizzards games really, I cancelled my subscription as soon as I found out., Blizzard has become a money thirsty company ever since Activision laid its dirty hand on it. Haven't been playing their games for a while already., Well then. Guess who's cancelling their WoW subscription?

Me. In case that wasnt clear. First I outlawed EA products in my home, blizzard are now on the list., Hey, one more reason to hate Activision-Blizzard Corporation!

I suppose I should thank the slimy reprobates, this is showing the Hong Kong situation to a lot of people who may not have heard about it until now. Mad props to BlitzChung for holding firm!, First NBA, then Activation-Blizzard, this is what's gonna happen to the world if CCP keep on getting away from violating human rights. The public must speak up and stand firm against censorship and the total authoritarian regime. Hong Kong might be the frontline of such movement, but the world should rally together before it is too late., >	As Andy reported earlier today, Blitzchung did not back down after the sudden removal of the broadcast, during which he wore a gas mask and goggles before shouting “Liberate Hong Kong, revolution of our age!” Following the incident he released a statement elaborating on his stance, writing “I know what my action on stream means. It could cause me lot of trouble, even my personal safety in real life. But I think it’s my duty to say something about the issue.”

Dude’s got magnitudes more spine than Blizzard., Hey I didn’t anyway so no reason for me to even try WoW, Well that fucking sucks. I love Blizzard and Blizzard games. They sure as hell don't make it easy to delete your account, fucc corporations. they mainly wanna associate with china for profits, All these corporations bowing down to a modern nightmare nation-state will lose my business. I'm sure the fake Chinese Twitter accounts will make up the business though., sadly gonna have to not buy a wow sub this year and so forth... sad i love HS and WOW not the way i wanted this company to go..., Alright then i really wanted to play overwatch again, not anymore, Blizzard has been complete garbage for a long time. Boycott away~~, Hey, a way to show support for the people in Hong Kong AND get more people to play TF2? I'm down!, >Not taking a political stance is a political stance

&#x200B;

>\[What blizzard is doing is\] A bit like taking a stand against a government that is beating its citizen to death, harvesting organs from political prisoners and running death camps., [Guess I am done with WoW.](https://imgur.com/gallery/LGi8zWh) It was fun while it lasted., I was going to buy Diablo 3 on PC this weekend, but I think I'll just torrent it instead., Deal., Weird.  I was planning on reopening my hearthstone account today but I guess I won't then, Fuck them, What a piece of shit company. They did not have to do this., Effective immediately: uninstalling overwatch and will no longer be purchasing on switch., Way ahead of you. Blizzard has been known to not be consumer friendly at all for years. To me this is the cherry on top of the shit cake., Cancelled my sub, I did not ,they were free xd, Done, Deleted Overwatch today. 

Ciao., A Hearthstone competitor (Gods Unchained - based on the Ethereum Blockchain where you are the true owner of your crypto/cards and censorship resistant) just tweeted this: 

https://twitter.com/GodsUnchained/status/1181487505180258304

.
@Blizzard_Ent
 just banned 
@blitzchungHS
 and stripped his Hearthstone winnings because they care about money more than freedom. We will pay for ALL his lost winnings and a ticket to our $500k tournament: no player should be punished for their beliefs. #freegaming, I was looking forward to Diablo 4. 

No more., [List of Blizzard games](https://en.wikipedia.org/wiki/List_of_Blizzard_Entertainment_games)	

[List of Activision games](https://en.wikipedia.org/wiki/List_of_Activision_video_games), What games did blizzard even make that are good besides WoW?

ALSO. Why are every major game companies publisher and developers alike, coming out all of a sudden like ""Yeah fuck our fan base and customers, we don't give a fuck."", Just sold all my atvi stock fuck blizzard, The players and casters violate the tournaments' rule, and that's why they are removed.  This is ridiculous to boycott Blizzard just because they are following through the tournament rules.  You should boycott all gaming tournaments in Hong Kong that have related rules as well., Fuck blizzard

Fuck china

Fuck Xi Jinping, What's interesting is that if the player instead advocated for China and **against** Hong Kong, Blizzard would have done the exact same thing yet the spin wound be ""Blizzard is fighting for Hong Kong by banning pro China player"" and they would be getting praise.

The rules clearly state that their platform should not be used for politics. It goes both ways... And it's a perfectly normal rule to have., Huge Blizzard Fan boy for about 10 years or more.  
Played almost all of their games .  
Heard about this -> Deleted everything.  
I can't support greedy companies that have 0 moral over money.   
^(Fuck you, Blizzard.), This is sad news. I love overwatch and OWL but I love human rights more....I can no longer support blizzard now, It’s fun watching my favorite gaming company (since the release of Warcraft 2) flush all of the respect I have for it down the drain. :/, yikes blizzard, time to go play some oldschool runescape, Not that I play their games to begin with, so boycotting will be incredibly easy for me. Still, I really hope this news kicks Blizzard in the financial balls. If they don't, the general message to corporations is going to be ""throwing basic human rights under the bus is ok as long as you make enough money from it"", then things are going to take a serious tumble downhill from there..., The same corporate proxy that the Chinese Communist Party uses to carry out economic reprisals on Americans in this story is called Tencent.

From the first article about this that was able to make it to the front page;

""Morey later deleted it, but not before Rockets owner Tilman Fertitta saw it on Twitter and quoted it with a response clarifying that it was not the franchise’s position.

A day later, numerous Chinese sponsors, and even the Chinese Basketball Association — with former Rockets franchise icon Yao Ming as its president — suspended their ties with the team.

In addition, Tencent Sports announced Sunday that all live streaming and news reporting of the Rockets would be suspended. The company gave customers who bought a subscription to watch Houston games online the opportunity to pick another NBA team""

https://old.reddit.com/r/nba/comments/debd72/us_presidential_candidate_yang_blasts_chinese/

Tencent is the company that put 150 million into Reddit that everyone was worried about;

""Tencent investment in Reddit sparks censorship worry""

https://www.thestar.com.my/tech/tech-news/2019/02/12/tencent-investment-in-reddit-sparks-censorship-worry

Don't say the wrong thing about China or the Chinese Communist Party will use its business proxies for economic reprisals.

We're talking on one of those business proxies right now.

If you want to save democracy in this country you get on here and tell everyone you can about Tencent and Reddit.

If there is not enough pressure you will see Reddit used in the exact same manner as all of these other corporations but Reddit is the *largest internet forum in the world*. 

Just imagine the unmitigated disaster that would befall free expression if this relationship isn't talked about **RIGHT NOW**., There are a few alternative games you might want to try out if you are considering migrating from Blizzard games:

* Loot Driven (Diablo III): Path of Exile
* MMORPG (WoW): FFXIV or Elder Scrolls Online. FFXIV is more similar to the feeling of WoW and has better PvE. I myself is trying FFXIV next.
* MOBA (HotS): HotS is not so hot anyways
* Hero Shooter (OW): I'm unfamiliar with its competitors in such a specific genre. Maybe TF2 as it is OW's predecessor.
* Real Time Strategy (War 3 and its future reboot, SC and SC2): they are still the kings of RTS and most non-Blizz RTS games came like a decade ago and don't have very populated competitive/online scenes. AOE2 HD has one, but you're probably better off waiting for the definitive edition., Please don't forget you can go to your app stores on your phone. Leave negative feedback for the battle.net authenticator and the WoW companion app., Don't forget to boycott Activision games as well.  
  
I used to play a lot of Overwatch, even going so far as getting top 2% in ranked play, but their blatant disregard and alienation of their playerbase in terms of balance and PR was apparent long ago - which made me quit. This only solidifies it., Is blizzard planning on selling their games to the Chinese government or to its citizens? Because if I were a Chinese citizen and knew that Blizzard pulled this shit, I would avoid their games from then on. And It’d be an effective way to protest without getting beat in the streets., ...]",2019-10-08 19:24:58
